{
  "description": "Type coercion: all string values from .env are coerced to native types",
  "options": {},
  "env_vars": {},
  "expected": {
    "bool_true_lower": true,
    "bool_true_upper": true,
    "bool_true_mixed": true,
    "bool_yes": true,
    "bool_on": true,
    "bool_one": true,
    "bool_false_lower": false,
    "bool_false_upper": false,
    "bool_no": false,
    "bool_off": false,
    "bool_zero": false,
    "int_port": 8080,
    "int_negative": -42,
    "int_large": 999999,
    "float_pi": 3.14,
    "float_negative": -0.5,
    "float_one": 1.0,
    "list_simple": ["a", "b", "c"],
    "list_numbers": [1, 2, 3],
    "list_mixed": [true, 42, "hello"],
    "list_spaces": ["a", "b", "c"],
    "null_empty": null,
    "null_word": null,
    "null_none": null,
    "null_nil": null,
    "string_plain": "hello world",
    "string_url": "https://example.com",
    "string_path": "/usr/local/bin",
    "string_version": "1.0.0",
    "string_whitespace_true": true
  }
}
